{
  "format_version": 2,
  "profile": "blendlib:morph_v1",
  "mesh": "x9:models3d/corpus.glb",
  "materials": { "Surface": { "base_color": "x9:textures/corpus.png" } },
  "capabilities": {
    "blendlib:cubic-spline": { "requirement": "required", "min_version": "1.0.0", "max_version": "2.0.0" },
    "blendlib:morph-targets": { "requirement": "required", "min_version": "1.0.0", "max_version": "2.0.0" },
    "blendlib:multiple-uv": { "requirement": "required", "min_version": "1.0.0", "max_version": "2.0.0" },
    "blendlib:richer-material-metadata": { "requirement": "required", "min_version": "1.0.0", "max_version": "2.0.0" },
    "blendlib:vertex-color": { "requirement": "required", "min_version": "1.0.0", "max_version": "2.0.0" },
    "example:metadata/cap00": { "requirement": "optional", "min_version": "1.0.0", "max_version": "2.0.0", "fallback": "metadata_ignore" },
    "example:metadata/cap01": { "requirement": "optional", "min_version": "1.0.0", "max_version": "2.0.0", "fallback": "metadata_ignore" },
    "example:metadata/cap02": { "requirement": "optional", "min_version": "1.0.0", "max_version": "2.0.0", "fallback": "metadata_ignore" },
    "example:metadata/cap03": { "requirement": "optional", "min_version": "1.0.0", "max_version": "2.0.0", "fallback": "metadata_ignore" },
    "example:metadata/cap04": { "requirement": "optional", "min_version": "1.0.0", "max_version": "2.0.0", "fallback": "metadata_ignore" },
    "example:metadata/cap05": { "requirement": "optional", "min_version": "1.0.0", "max_version": "2.0.0", "fallback": "metadata_ignore" },
    "example:metadata/cap06": { "requirement": "optional", "min_version": "1.0.0", "max_version": "2.0.0", "fallback": "metadata_ignore" },
    "example:metadata/cap07": { "requirement": "optional", "min_version": "1.0.0", "max_version": "2.0.0", "fallback": "metadata_ignore" },
    "example:metadata/cap08": { "requirement": "optional", "min_version": "1.0.0", "max_version": "2.0.0", "fallback": "metadata_ignore" },
    "example:metadata/cap09": { "requirement": "optional", "min_version": "1.0.0", "max_version": "2.0.0", "fallback": "metadata_ignore" },
    "example:metadata/cap10": { "requirement": "optional", "min_version": "1.0.0", "max_version": "2.0.0", "fallback": "metadata_ignore" },
    "example:metadata/cap11": { "requirement": "optional", "min_version": "1.0.0", "max_version": "2.0.0", "fallback": "metadata_ignore" },
    "example:metadata/cap12": { "requirement": "optional", "min_version": "1.0.0", "max_version": "2.0.0", "fallback": "metadata_ignore" },
    "example:metadata/cap13": { "requirement": "optional", "min_version": "1.0.0", "max_version": "2.0.0", "fallback": "metadata_ignore" },
    "example:metadata/cap14": { "requirement": "optional", "min_version": "1.0.0", "max_version": "2.0.0", "fallback": "metadata_ignore" },
    "example:metadata/cap15": { "requirement": "optional", "min_version": "1.0.0", "max_version": "2.0.0", "fallback": "metadata_ignore" },
    "example:metadata/cap16": { "requirement": "optional", "min_version": "1.0.0", "max_version": "2.0.0", "fallback": "metadata_ignore" },
    "example:metadata/cap17": { "requirement": "optional", "min_version": "1.0.0", "max_version": "2.0.0", "fallback": "metadata_ignore" },
    "example:metadata/cap18": { "requirement": "optional", "min_version": "1.0.0", "max_version": "2.0.0", "fallback": "metadata_ignore" },
    "example:metadata/cap19": { "requirement": "optional", "min_version": "1.0.0", "max_version": "2.0.0", "fallback": "metadata_ignore" },
    "example:metadata/cap20": { "requirement": "optional", "min_version": "1.0.0", "max_version": "2.0.0", "fallback": "metadata_ignore" },
    "example:metadata/cap21": { "requirement": "optional", "min_version": "1.0.0", "max_version": "2.0.0", "fallback": "metadata_ignore" },
    "example:metadata/cap22": { "requirement": "optional", "min_version": "1.0.0", "max_version": "2.0.0", "fallback": "metadata_ignore" },
    "example:metadata/cap23": { "requirement": "optional", "min_version": "1.0.0", "max_version": "2.0.0", "fallback": "metadata_ignore" },
    "example:metadata/cap24": { "requirement": "optional", "min_version": "1.0.0", "max_version": "2.0.0", "fallback": "metadata_ignore" },
    "example:metadata/cap25": { "requirement": "optional", "min_version": "1.0.0", "max_version": "2.0.0", "fallback": "metadata_ignore" },
    "example:metadata/cap26": { "requirement": "optional", "min_version": "1.0.0", "max_version": "2.0.0", "fallback": "metadata_ignore" }
  }
}
