{
  "format_version": 2,
  "profile": "blendlib:skinned_v2",
  "mesh": "x9:models3d/skinned_candidate.glb",
  "units_per_block": 1.0,
  "materials": {
    "CandidateSurface": {
      "base_color": "x9:textures/x9/candidate.png",
      "mode": "cutout",
      "double_sided": false,
      "metallic_factor": 0.25,
      "roughness_factor": 0.75,
      "normal_texture": "x9:textures/x9/candidate_normal.png",
      "occlusion_texture": "x9:textures/x9/candidate_ao.png",
      "emissive_texture": "x9:textures/x9/candidate_emissive.png",
      "emissive_factor": [0.1, 0.2, 0.3],
      "alpha_cutoff": 0.5
    }
  },
  "capabilities": {
    "blendlib:cubic-spline": { "requirement": "required", "min_version": "1.0.0", "max_version": "2.0.0" },
    "blendlib:vertex-color": { "requirement": "required", "min_version": "1.0.0", "max_version": "2.0.0" },
    "blendlib:multiple-uv": { "requirement": "required", "min_version": "1.0.0", "max_version": "2.0.0" },
    "blendlib:richer-material-metadata": { "requirement": "required", "min_version": "1.0.0", "max_version": "2.0.0" }
  }
}
