{
  "format_version": 2,
  "profile": "blendlib:morph_v1",
  "mesh": "x9:models3d/uv0_only_morph.glb",
  "materials": { "Surface": { "base_color": "x9:textures/uv0_only.png" } },
  "capabilities": {
    "blendlib:cubic-spline": { "requirement": "required", "min_version": "1.0.0", "max_version": "2.0.0" },
    "blendlib:morph-targets": { "requirement": "required", "min_version": "1.0.0", "max_version": "2.0.0" },
    "blendlib:richer-material-metadata": { "requirement": "required", "min_version": "1.0.0", "max_version": "2.0.0" },
    "blendlib:vertex-color": { "requirement": "required", "min_version": "1.0.0", "max_version": "2.0.0" }
  }
}
